ID,Title,Location,Salary,Summary
http://kr.indeed.com/viewjob?jk=409c1253b2dde75b,동국대학교 데이터분석팀 연구원(계약직) 채용공고,동국대학교 4.3 서울 필동,,"자 4) 남자의 경우 병역필 또는 면제자 5) 한글, MS OFFICE 등 기본 문서작업 가능자 6) Python, R 프로그래밍 언어 사용 가능자 우대 2. 모집인원 : O명 3. 근무조건 및 계약기간 구 분..."
http://kr.indeed.com/viewjob?jk=d3a6ba916d772b85,[인공지능기업] 병역특례 산업기능요원 (SW개발자),머니브레인 서울,,JAVA|인터넷·IT·통신·모바일·게임>웹프로그래머>JSP|인터넷·IT·통신·모바일·게임>웹프로그래머> Python|인터넷·IT·통신·모바일·게임>응용프로그래머>C·C++|인터넷·IT·통신·모바일·게임>응용프로그래머>.NET...
http://kr.indeed.com/viewjob?jk=db55ee61f98e6816,DGIST 동반진단의료기술융합연구실 계약직 연구원 채용 공고,대구경북과학기술원 대구 현풍면,,데이터 통계 분석 AI 기반 데이터 분석을 위한 대용량 고속 데이터 처리 DB 구축 우대 사항 Python/Jave 기반 생체 정보 데이터 분석 경험자 대용량 고속 데이터 처리 DB 구축 경험자 급여수준...
http://kr.indeed.com/viewjob?jk=6b86ea39985912b6,NHN Cloud 사업기획/영업,NHN 4.4 성남 판교역,,"Linux, Microsoft Solutions 등) - 2년 이상의 개발 경험 (Java, Python 등) - 기술 문서 작성 및 가이드 경험이 풍부한 자 - 대외 고객 기술 지원 경험 공통지원자격..."
http://kr.indeed.com/viewjob?jk=5331de34a85a125a,[코그넥스] 딥러닝 연구원 (신입/경력/전문연구요원),코그넥스코리아 서울 서초구,,"network 등) - Deep Learning 방법론에 대한 데모 프로그램 제작 및 제품화 코드 작성 ( Python / C++) - 다양한 종류의 제조업 이미지 데이터에 대한 탐색, 분석 및 전처리 모듈 구현 - 최신..."
http://kr.indeed.com/viewjob?jk=1b62babbbf2d717a,경험최적화 - 데이터 사이언티스트/분석가,Nexon 성남 분당구,,피처 탐색 등) - 게임 내 행동 패턴 로그 분석과 패턴 식별 및 이를 통한 서비스 개선 지원자격 - Python을 사용한 데이터 분석 및 모델 개발 경험 - 머신러닝 라이브러리 활용 경험 - 셀프 모티베이션과 원활한...
http://kr.indeed.com/viewjob?jk=65fbf450de2972b2,[PUBG: NEW STATE] 시네마틱 이펙터,PUBG 서울,,"및 PUBG에 대한 관심과 이해 언리얼 머테리얼/블루프린트 제작에 능숙하신분 RnD 좋아하시는 분 C++, Python 사용 경험자 고용 형태 정규직 근무지 서초 본사 제출 서류 입사지원서 (자유 양식), 경력기술서 및 자기..."
http://kr.indeed.com/viewjob?jk=f97d8d627c3d7362,Infra Software Engineer,Toss 서울 강남구,,"분 - Software-intensive system의 구조 설계 경험이 있는 분 - C, Golang, Python, Javascript 중 하나 이상의 언어에 능숙하신 분 # 우대 사항 - 다양한 기반 기술에 대한 이해도..."
http://kr.indeed.com/viewjob?jk=5f25c484aa306813,Home based Software Engineering Lead - O...,Canonical - Jobs 서울,,"communities... marketplace. You have deep experience with Python, Golang, the Linux system itself, or all three. You..."
http://kr.indeed.com/viewjob?jk=9f7793affee60ccc,"Sales Engineer (Pre-Sales), Korea",Recorded Future 서울,,"required Technical skills: Coding experience preferred (i.e. Python), JSON familiarity a plus Experience in an analytical..."
http://kr.indeed.com/viewjob?jk=6e00e6e011a3ac8f,[정규직] SK이노베이션 데이터 플랫폼 개발/운영,SK 씨앤씨 4.0 서울,,"AWS Data 서비스 이해 - Data Pipeline 설계/운영 경험 (Spark, SQL, Python 역량 보유 우대) - Data MART 설계 및 구축 경험 우대 (ETL 개발/경험) - 제조 Industry..."
http://kr.indeed.com/viewjob?jk=f54d416a3c78e275,DBA경력직,한국사이버결제 서울 구로구,,"mariadb ) 유 경험자 2) 프로그래밍 가능자 ( shell, php, jsp, jquery, python, c, java .. 등 ) 3) OS( LINUX, AIX) 관련 자격 보유자 4) 오라클 자격 보유자..."
http://kr.indeed.com/viewjob?jk=f19b8cb8881146ea,DGIST-ETH 마이크로로봇연구센터 계약직 연구원 공개 초빙 공고,대구경북과학기술원 대구 현풍면,,"으신 분 우대 MATLAB, Python 등을 사용한 기본적인 프로그래... ANSYS 등) 모델 개발 우대 사항 MATLAB, Python 등을 사용한 기본적인 프로그래밍 경 험자 우대 Fluorescence..."
http://kr.indeed.com/viewjob?jk=f2cca1a985038942,[EY한영] 감사본부 파생상품평가부서(DVC) 경력직 모집,Ernst & Young 4.0 대한민국,,"우대사항 - 금융공학/수학/컴퓨터 관련 전공자 - 이자율 파생상품 평가관련 지식 보유자 - C++/C, Python, VBA, QuantLib 활용 개발 유경험자 * 전형절차 - 1차 서류 심사 - 2차 실무 면접..."
http://kr.indeed.com/viewjob?jk=10801913e0cc1dea,Senior Applications Engineer - Transport...,National Instruments 서울,,"power grid, etc. Text-Based Programming, C++, VB, Java, Python, etc. Experience in developing in RT based microcontrollers..."
http://kr.indeed.com/viewjob?jk=f611a72cc9b1761e,CTO 혁신추진실 AID팀 Machine Learning&AI 정규직,이투스교육 서울 강남구,,"구축 지원자격 ﻿일반적인 Back-end 시스템 설계 및 개발 ML/AI 시스템 아키텍쳐 설계 경험 Python, scala, R 등 ML 및 통계 관련 언어 사용 경험 머신러닝 프레임워크 경험자 (TensorFlow..."
http://kr.indeed.com/viewjob?jk=1d02cb9fea0f13ef,Quality Specialist for Software Engineer...,SAP 4.3 서울,,"language like python Preferred Experience with Docker, K8S, Git/Gerrit, Linux, and programming languages... Python, Go..."
http://kr.indeed.com/viewjob?jk=33caa1d9a2c68113,클라우드 데이터플랫폼 운영 엔지니어,NHN SOFT 4.4 성남 판교역,,"력자 -대외 고객 기술 지원 경험자 -클라우드 플랫폼 운영 경험자 -2년 이상의 개발 경험자(Java, Python 등) -Hadoop 에코시스템을 통한 데이터 수집, 처리 및 지표 분석 경험 본 채용은 상시 채용으..."
http://kr.indeed.com/viewjob?jk=c721e9c6f6b97595,HW/SW 분야 직무 교육 전문강사,에이치에스글로벌 서울 강남구,,통신·모바일·게임>응용프로그래머>인공지능(AI)|인터넷·IT·통신·모바일·게임>빅데이터·AI(인공지능)> Python|인터넷·IT·통신·모바일·게임>빅데이터·AI(인공지능)>빅데이터|인터넷·IT·통신·모바일·게임>빅데이터·AI...
http://kr.indeed.com/viewjob?jk=4e582cf138209b17,K-POP 엔터테인먼트 플랫폼 서버 프로그래머 모집,엔씨소프트 2.7 성남 판교역,,"비스 관리툴 개발 - 로깅/데이터 분석 도구 개발 지원자격 학력 : 무관 경력기간 : 3년 ~ 필수조건 - Python 개발이 능숙하신 분 - HTML5, Javascript, css 등 기본적인 웹 환경의 이해를 바탕으로..."
http://kr.indeed.com/viewjob?jk=9c15d2c0cd7b70d8,프론트엔드개발 인공지능바이오제약코스닥기업,서울특별시,,"개선과 신규 서비스의 UI, 기능을 설계 및 개발 ※ 지원자격 - python 개발 경험(기본) - non-sql DB, sql DB 중 1개 이상... 사용 경험 - 풀스택 개발자 - python, C# 동시 사용 ※ 지원방..."
http://kr.indeed.com/viewjob?jk=c610c1b88e90ddb8,네이버 클라우드 플랫폼 기술지원,엔아이티서비스 성남 분당구,,"사항]- 클라우드 서비스 운영 경험 (AWS, Azure, KT Cloud 등)- Shell Script, Python 활용 가능- 국가보훈대상자 및 장애인은 법령에 의거 우대 (※입사지원 시 보훈/장애사항 체크 필수)[고용..."
http://kr.indeed.com/viewjob?jk=d69b5a1e60c65ce6,데이터 마케팅 경력사원,LG전자 3.8 서울 영등포구,,"능력 보유자 (SQL, R, Python, Scalar, Hadoop 등... 운영 경험자 - CRM 캠페인 기획/운영 경험자 - SQL, R, Python 등 통계 패키지 활용 자격증 보유자 모집기한: ~ 본 포지션 채용 시점..."
http://kr.indeed.com/viewjob?jk=14ed8097b3b4d463,[TGD] Data Scientist 모집,엔씨소프트 2.7 성남 판교역,,"지원자격 학력 : 무관 경력기간 : 3년 ~ 10년 필수조건 DB 성능까지 고려한 SQL 프로그래밍 가능자 Python을 이용한 데이터 분석 3년 이상 경력자 (SAS, SPSS 등 통계툴만 사용 가능한 경우 제외) 대용량..."
http://kr.indeed.com/viewjob?jk=e97e5ff34697d5a9,[KRAFTON] 음성 (TTS/STT) 딥러닝 엔지니어,PUBG 서울,,험을 보유하신 분 독창적인 기술 제시 및 문제 해결을 위한 프로그래밍 능력을 보유하신 분 (C/C++/ Python/shell 등) 오픈소스 기반 딥 러닝 프레임워크 활용 능력을 보유하신 분 (PyTorch/TensorFlow...
http://kr.indeed.com/viewjob?jk=d6cae7bd4946ef0f,서린상사(주) Web 개발자 경력사원,서린상사 서울 강남구,,"가능, 브라우저 개발 경험(javascript, jQuery, Angular, Vue 등)- 서버 개발 경험( Python, Node 등), 데이터베이스 개발 경험(Oracle, SQLite, MongoDB 등), Git 활용..."
http://kr.indeed.com/viewjob?jk=36ae5f764253d121,AI 연구 MLOps,코그넷나인 서울 서초구,,"training, Deployment System) Kubernetes GPU Cluster 관리 자격요건 Python, Golang 을 이용한 실무 개발 경험 Git 사용 실무 경험 3년 이상 Linux 인프라 세팅..."
http://kr.indeed.com/viewjob?jk=d8a8869ab092f731,데이터 엔지니어 및 사이언티스트,카카오 4.0 성남 판교역,,"등 데이터 엔지니어와 사이언티스트의 업무를 경계 없이 수행하게 됩니다. 지원자격 개발 경력 3년 이상 Python, Scala, Java, C++ 중 하나 이상의 언어에 능통 SQL 또는 HiveQL에 능통 대용량 데이..."
http://kr.indeed.com/viewjob?jk=6985dbbbf83fb8c2,RPA Developer ( 1 year contract),UiPath 서울,,"object-oriented programming (C#, C++, VB, .NET, Java, or Python preferred). Those with more experience may be considered..."
http://kr.indeed.com/viewjob?jk=acdfee714d718c41,Data Scientist 경력인재 - 글로벌 우량대기업,에스에프인촌 서울,,모바일·게임>빅데이터·AI(인공지능)>데이터분석|인터넷·IT·통신·모바일·게임>빅데이터·AI(인공지능)> Python|인터넷·IT·통신·모바일·게임>빅데이터·AI(인공지능)>데이터시각화디자이너|인터넷·IT·통신·모바일·게임...
http://kr.indeed.com/viewjob?jk=14ed8097b3b4d463,[TGD] Data Scientist 모집,엔씨소프트 2.7 성남 판교역,,"지원자격 학력 : 무관 경력기간 : 3년 ~ 10년 필수조건 DB 성능까지 고려한 SQL 프로그래밍 가능자 Python을 이용한 데이터 분석 3년 이상 경력자 (SAS, SPSS 등 통계툴만 사용 가능한 경우 제외) 대용량..."
http://kr.indeed.com/viewjob?jk=993c7288a61b8fce,로봇 시스템 아키텍쳐 및 다중 분산 시스템 아키텍쳐,국내 대기업 / 화물 운송업 / 조단위 이상 매출 기업 서울 중구,,"경험 또는 물류사업 이해도를 갖춘 경력 우대 • 요구조건 - 중급 이상의 프로그래밍 언어 (C/C++, Python, JAVA) 활용능력 보유자 - 영어/중국어 회화 중급(OPIc IM2 또는 이에 상응하는 레벨) 이상..."
http://kr.indeed.com/viewjob?jk=dbe3257e487e5814,[AI/Lab] AI 백엔드 엔지니어 (전문연구요원 가능),버즈니 서울,,"플랫폼 및 시스템 구축 이런 분을 찾습니다 주도적으로 문제를 찾고, 해결할 수 있는 능력을 보유하신 분 Python 사용 경험이 있으신 분 다음 항목 중 두 가지 이상에 해당되는 분 AWS 혹은 GCP와 같은 클라우드 플랫폼..."
http://kr.indeed.com/viewjob?jk=6ac83986c1779aee,프로그래머 (어플리케이션 개발자 또는 웹개발자),오너클랜 서울 금천구,,인터넷·IT·통신·모바일·게임>응용프로그래머>자바스크립트|인터넷·IT·통신·모바일·게임>응용프로그래머> Python|인터넷·IT·통신·모바일·게임>응용프로그래머>C#|인터넷·IT·통신·모바일·게임>웹프로그래머>웹개발|인터넷...
http://kr.indeed.com/viewjob?jk=cae2de07045cfb2b,"Java, Python 영상툴 개발자",에이아이메이커 서울 마곡동,,원하면 가능) 담당업무 - 영상 라벨링 Tool 개발 - Tool 정확성 개선 자격요건 - Java - Python 우대사항 - 관련 개발 경력 - 툴개발 경력 근무조건 - 월~금 AM9:30 ~ PM18:30 복지...
http://kr.indeed.com/viewjob?jk=7af6301dc691d3ab,Data Scientist,Toss 서울 강남구,,"실무 경험 5년 이상 갖추신 분 - 실제 서비스 데이터를 이용한 분석모델 개발 경험이 있으신 분 - R, Python, Scala, SQL 등 데이터 분석의 업무를 수행할 수 있는 하나 이상의 개발 언어에 능숙하신 분 #..."
http://kr.indeed.com/viewjob?jk=e8abe98a79dfc9aa,정보 보안 운영 관리 엔지니어,이스트게임즈 서울 서초구,,"각종 해킹 시도 분석)- 각종 보안 시스템 구축 및 운영 관리(IPS, 웹 방화벽)- 업무 자동화 툴 개발( Python , Bash, PHP, C# 등) [자격요건]- 정보 시스템에 대한 기본적 이해도가 높은자(Windows..."
http://kr.indeed.com/viewjob?jk=d585814d097935eb,카카오톡 보이스톡/페이스톡/라이브톡 개발자 모집,카카오 4.0 성남 판교역,,"우대 사항 ✓ Spring/Java 혹은 Spring/Kotlin 기반 서버 개발 경험 ✓ MySQL, Python, JavaScript, Node.js 경험 ✓ 모바일/웹 환경을 위한 API 시스템 개발 경험 ✓ k8s..."
http://kr.indeed.com/viewjob?jk=665c109491ded05f,[웹젠] 프로그래밍(경력),웹젠 성남 분당구,,"사용자 - 유연한 사고와 원활한 의사소통 능력 보유자 ﻿ 우대사항 - Python, freebsd, MySql 경험자 - STL, Socket... 소통 능력 보유자 ﻿ 우대사항 - Python, freebsd, MySql..."
http://kr.indeed.com/viewjob?jk=e29ab2210c23b65f,[진행중] 우리은행 빅데이터사업부 전문직(데이터 사이언티스트(데이터분석가...,우리은행 4.5 서울 회현동,,ML/DL 기술을 활용한 분석모델 개발 및 서비스를 적용해 본 경험이 있는자 - 데이터 분석을 위한 언어( Python/R)를 하나 이상 능숙하게 다룰 수 있는자 우대사항 - 금융분야 ML/DL 관련 업무 경력 2년...
http://kr.indeed.com/viewjob?jk=c0ffa15d7b0a267f,춘천성심병원 인공지능센터 연구원 채용 공고,한림대학교춘천성심병원 강원도 춘천,,데이터 구축 및 관리 데이터 수집 파이프라인 구축 및 표준화 데이터 분석 및 python 코딩 CDM 매핑 관련 업무 석사 학위 취득자 python 딥러닝 코딩 가능자 CDM 경험자 우대 서버관리 경험자 우대 계약직 2...
http://kr.indeed.com/viewjob?jk=79d51413840f92a2,(HW 직군) 카메라 ISP/SoC 설계 및 검증,한화그룹 4.2 서울,,"Language 필수, Python 가능 - Image Processing... 설계, System-Verilog 및 UVM 설계 - C/C++, Python 가능, Timing report 분석 가능(DC, PT) O명 판교..."
http://kr.indeed.com/viewjob?jk=ae22088cdea0b40c,(주)아이옵스 소프트웨어 개발자,아이옵스 대전 유성구,,"트스트랩, 웹개발, C++, C#, python, java 등 1개 이상의... 우대사항] - 자바스크립트, 부트스트랩, 웹개발, C++, C#, python, java 등 1개 이상의 개발환경 능숙자 - Windows..."
http://kr.indeed.com/viewjob?jk=5d6fe86a441b59ba,Data Science Intern,Ace I&M Consulting 서울 중구,"월급 1,800,000원","projects on a time-series data. • Proficiency in SQL, Python, R (not required), MATLAB (not required), Java (not required..."
http://kr.indeed.com/viewjob?jk=d69b5a1e60c65ce6,데이터 마케팅 경력사원,LG전자 3.8 서울 영등포구,,"능력 보유자 (SQL, R, Python, Scalar, Hadoop 등... 운영 경험자 - CRM 캠페인 기획/운영 경험자 - SQL, R, Python 등 통계 패키지 활용 자격증 보유자 모집기한: ~ 본 포지션 채용 시점..."
http://kr.indeed.com/viewjob?jk=3c516818303c4d51,Application Engineer (Silicondash),Synopsys 서울,,"disk access Programming skill of TCL, Perl, JavaScript or Python Good documentation and reporting skills are required..."
http://kr.indeed.com/viewjob?jk=b6dead086316ba8e,신경망 연구 개발자,에스알유니버스 서울 마포구,"연봉 40,000,000원 - 50,000,000원","신입, 경력(연차무관)학력사항: 대학교(4년)졸업직무기술: 딥러닝, Python, TensorFlow, openCV[우대사항]전공계열: 공학계열... 게임>빅데이터·AI(인공지능)> Python|인터넷·IT·통신·모바일·게임..."
http://kr.indeed.com/viewjob?jk=b2661d357cf26c8f,플랫폼쉴드 시스템 개발,Nexon 성남 분당구,,"IP, 평판 등의 정보) 지원자격 - 전체 개발 경력 3~5년 - Python, Go 개발경력 우대(팀 내부 주 개발 언어가 Go, Python) - 비동기, 병렬처리 프로그래밍 기술 - OS, DB, H/W, 네트워..."
http://kr.indeed.com/viewjob?jk=a4b72e38fb50bde0,콘텐츠서비스개발- 데이터엔지니어,Nexon 성남 분당구,,"ecosystem 에 대한 이해 - Python, Scala 등의 프로그... 경험이나 운영 경험 - 소프트웨어 빌드 및 배포 자동화 경험 - Python 또는 NodeJS를 활용한 시스템 개발 경험 - 프론트엔드 및 웹..."
http://kr.indeed.com/viewjob?jk=9f3584bb8608ccfc,데이터베이스 관리자,아이엠아이 전주 덕진구,"연봉 30,000,000원 - 32,000,000원","이해 - 시스템 안정성을 위한 모니터링 및 알림도구 구축 경험 - 모니터링 지표에 대한 이해 - Ruby, Python 상세모집요강 접수기간/방법 지원방법 전형절차 및 제출서류 제출서류 이력서에 응시분야, 연락처, 희망연봉 기재"
http://kr.indeed.com/viewjob?jk=1a75ce748c5f24e9,TOAST CAM 임베디드 개발,NHN 4.4 성남 판교역,,"또는 석사 학위 또는 그에 준하는 실무 경험자 (신입 지원가능) - 임베디드 환경에서 영상 처리 경험자 - Python, C++ 개발 경험 - 딥러닝 프레임워크, 컴퓨터 비젼 경험자 - Visual Object..."
http://kr.indeed.com/viewjob?jk=22fce0a32d1b021c,Corporate Application Engineer – Calibre...,Mentor Graphics (Korea) LLC 4.0 경기도 성남,,"Linux OS, and previous experience with scripting or Tcl/ Python/Perl programming preferred Familiar with Siemens EDA’s Calibre..."
http://kr.indeed.com/viewjob?jk=30f2e2281788781b,SKT 통합관제 플랫폼 개발/운영,SK 씨앤씨 4.0 서울,,"Big Data 플랫폼 구축 경험(우대) 역량/스킬 1. 필수역량 - Java, SQL 중급 이상 - Python 활용 배치 프로그램 개발 2. 우대역량 - Splunk, Hadoop, ELK - Prometheus..."
http://kr.indeed.com/viewjob?jk=2c4c5856662783e7,Data Analyst,IQVIA 서울,,learning / predictive modeling ) • 통계 프로그램 활용 능력 SAS / R / Python 중 최소 1가지 중급 이상의 활용능력 요구 • Communication Basic English...
http://kr.indeed.com/viewjob?jk=1e974ff27c6eb340,Autonomous Driving 분야 엔지니어,포티투닷 서울 강남구,,"프로그래밍 기술 (C/C++, Python 등) - 이동 로봇/드론 관련... platform 개발 경험 - 뛰어난 프로그래밍 기술 (C/C++, Python) - 3D geometry, math, physics 관련 경험 및..."
http://kr.indeed.com/viewjob?jk=3933762f9f06df56,Data Scientist(CSS 모델링),Toss 서울 강남구,,"3년 이상) - 머신러닝 등 최신 알고리즘을 활용하여 실제 비즈니스 문제 해결 경험이 있으신 분 - SQL, Python, R 등 통계/분석 프로그램을 다룰 수 있으신 분 # 우대 사항 - 금융권 데이터 분석 및 모델링 업무..."
http://kr.indeed.com/viewjob?jk=36df1dfea186e63e,BIOS/Firmware Engineer,Intel 4.1 서울,,"years experience required on BIOS/Firmware - Knowledge of C, Python... other programming or scripting languages - Broad..."
http://kr.indeed.com/viewjob?jk=3d6c266ae2b4771e,[카카오맵] 검색/추천 개발자 모집,카카오 4.0 성남 판교역,,"로그 분석 품질 개선점 도출 사용자 피드백 분석 로그 분석 시스템 개발 지원자격 사용하는 기술셋 Python, Java Flask, Spring ML, Pandas SQL, Spark, Hadoop Echo System..."
http://kr.indeed.com/viewjob?jk=752a4b5d63eac97c,Back-end Engineer (Python),Soomgo 서울 강남구,,숨고의 백엔드 엔지니어( Python)는 숨고의 기반 기술을 담당하는 매우... 5년 이상의 웹/앱 서비스 백엔드 시스템 개발 경험이 있는 분 • Python 언어를 활용한 개발 경험이 있는 분 • 성능 최적화에 대해 지속적으로...
http://kr.indeed.com/viewjob?jk=51968ccd6c40b188,대기업 빅데이터 분석 전문가,국내 대기업 / 화물 운송업 / 조단위 이상 매출 기업 서울 중구,,"서비스 분석 경험자 우대 • 요구조건 - 대용량 DBMS 처리 - 분석 지원 언어/패키지(SQL/SAS/R/ Python/Spark) 사용가능자 또는 자격증 보유자 - 빅데이터 Tool (Hadoop, Hive, Hbase..."
http://kr.indeed.com/viewjob?jk=d8a8869ab092f731,데이터 엔지니어 및 사이언티스트,카카오 4.0 성남 판교역,,"등 데이터 엔지니어와 사이언티스트의 업무를 경계 없이 수행하게 됩니다. 지원자격 개발 경력 3년 이상 Python, Scala, Java, C++ 중 하나 이상의 언어에 능통 SQL 또는 HiveQL에 능통 대용량 데이..."
http://kr.indeed.com/viewjob?jk=833a4d9bb5840b70,Senior Data Scientist (Korea),FPT Software 대한민국,,"deploy custom code in a variety of environments ( Python, SAS, R, etc.) to create predictive analytics applications. Use..."
http://kr.indeed.com/viewjob?jk=20d40ee61adffeca,챗봇 및 상담 플랫폼 서버 개발자 모집,카카오 4.0 성남 판교역,,"담시스템 코어 서버 개발 (kotlin/spring) QA 시스템 백엔드 서버 개발 (java/spring, python/flask) 챗봇 및 상담 통계 시스템 개발 (scala/spark) 위의 업무 중 하나에 참여하게..."
http://kr.indeed.com/viewjob?jk=68a69dd27ac61230,(데이터개발) 데이터 엔지니어,Nexon 성남 분당구,,"끊임없이 흐르는 데이터를 모니터링하고 오류를 감지하는 시스템을 구축 지원자격 - Linux 환경에서 Python, Scala, Java, Go 중 한 가지 이상의 언어로 개발이 가능하신 분 - 자료구조, 알고리즘, 데이터..."
http://kr.indeed.com/viewjob?jk=d017610d9828199c,"드론 데이터 스타트업, 엔젤스윙 엔지니어",엔젤스윙 서울 관악구,,"Ruby on Rails, Python, C++, AWS AWS, GCP... 기반 웹서비스 개발 경험 디버깅, 최적화 스킬 Javascript, Python, C++ 등 개발언어 중 자신있는 언어가 1가지 이상 있으신 분..."
http://kr.indeed.com/viewjob?jk=b9a9af798e9d24a5,보안 개발자 모집,넷마블 서울 구로구,,"이상의 웹 프레임워크 사용 숙련자 - 신기술 습득과 개발을 좋아하며 동료와 함께 성장하고 싶으신 분 우대사항 - Python(django, flask)을 이용한 back-end 개발 경험 있으신 분 - javascript..."
http://kr.indeed.com/viewjob?jk=49526de7ae1c788c,[TmaxCloud/기술] ProLinux QA,티맥스소프트 성남 분당구,,"사용 경험(RHEL, CentOS 등..) - ISTQB/CSTS 등 자격증 보유자 - 테스트 자동화용 Shell script 작성 경험자 - Python 사용 경험자 모집기간 2021/05/03 ~ 2021/05/23"
http://kr.indeed.com/viewjob?jk=1d02cb9fea0f13ef,Quality Specialist for Software Engineer...,SAP 4.3 서울,,"language like python Preferred Experience with Docker, K8S, Git/Gerrit, Linux, and programming languages... Python, Go..."
http://kr.indeed.com/viewjob?jk=7167a9017f74cb92,프로그래머 신입/경력 정규직,스타플러스 서울 서초구,,용이 취소될 수 있습니다. 인터넷·IT·통신·모바일·게임>웹프로그래머> Python|인터넷·IT·통신·모바일·게임>웹프로그래머>웹개발|인터넷·IT·통신... 통신·모바일·게임>응용프로그래머> Python|인터넷·IT·통신·모바일·게임...
http://kr.indeed.com/viewjob?jk=9adbc290202846e1,[아이브릭스] 기업부설연구소 전문연구요원,아이브릭스 성남 분당구,,모바일·게임>응용프로그래머>JAVA|인터넷·IT·통신·모바일·게임>응용프로그래머>자바스크립트|인터넷·IT·통신·모바일·게임>빅데이터·AI(인공지능)>머신러닝|인터넷·IT·통신·모바일·게임>빅데이터·AI(인공지능)> Python
http://kr.indeed.com/viewjob?jk=8af26b37623864c4,8퍼센트 개발자 (신입/경력),8퍼센트 서울 종로구,,개발 금융 데이터 분석과 분석 플랫폼 운영 자격요건 컴퓨터 전공자 또는 웹 개발 경력 1년 이상 우대사항 Python 코드를 무리 없이 읽으실 수 있는 분 Linux/Mac 사용 가능한 분 새로운 기술에 대한 호기심을 가지신...
http://kr.indeed.com/viewjob?jk=d13fce11058e6cf1,보안 모니터링 시스템 개발 및 운영 담당자 모집,카카오 4.0 성남 판교역,,"이터 분석을 위한 SIEM/ETL 플랫폼 개발/운영 지원자격 기본사항 경력 3년 이상 Java, Python 등의 언어로 개발 가능자 기본적인 웹 개발 및 Back-End 개발 가능자 DBMS 혹은 빅데이터(NoSQL..."
http://kr.indeed.com/viewjob?jk=43f8edb38c7888c7,위메프오 서버개발자(정규직),위메프 2.8 대한민국,,"데이터베이스 분산설계 및 미들웨어 개발 [자격사항] - 서버 프로그래밍 언어(PHP, Go, C/C++, Python, Java) 중 1개 이상 사용이 가능한 분 - 자료구조, 알고리즘, 분산처리 등 SW관련 기본지식 보유..."
http://kr.indeed.com/viewjob?jk=d6c05c588971df5a,백엔드 파운트 시스템 엔지니어 (현재 급여수준 이상 보장),파운트 서울 충정로역,,"경험 - Linux명령어 및shell스크립트 작성 능숙 우대사항 - Python, Java등을 이용한 프로그래밍 경험 네트워크및 서버에 대한 표준화... 립트 작성 능숙 우대사항 - Python, Java등을 이용한 프로그래..."
