ID,Title,Location,Salary,Summary
http://kr.indeed.com/viewjob?jk=641ae0914b7eb183,농업정책보험금융원 신규직원,농업정책보험금융원 서울,,"제출 통계 패키지*를 활용하여 통계, 응용통계 및 데이터 분석 업무 경력이 1년 이상인 자 * SAS, R, python 등 * 경력증명서(담당업무 혹은 소속부서로 업무 추정이 가능할 경우 소속부서가 명시되어야 함) 제출..."
http://kr.indeed.com/viewjob?jk=464ad076ec3e1fa0,CHC – Business intelligence - TOM_2136,Sanofi 4.1 서울,,"degree in related field Business-level experience with R, Python Experience owning the analytics and performance of a large..."
http://kr.indeed.com/viewjob?jk=d17da0baecf05910,데이터 분야 경력,LG CNS 3.7 서울,,"해가 뛰어난 자 - R, Python, SAS, SQL 등 활용 역량 우대사항(해당 내용 중 1개 이상) - ML/DL 경험 인력 우대 - 관련 분야 석사 이상 학위 소지자 우대 - R, Python등 데이터분석 모델링 경험..."
http://kr.indeed.com/viewjob?jk=ee9712110ac151a2,(주)솔리메틱스 - Python 프로그램 개발자,솔리메틱스 강원도 춘천,"연봉 25,000,000원 - 40,000,000원",직무내용] Python 프로그래밍 개발자Java + Python 개발 경력자 (우대) [근무시간 및 형태] 주 5일 근무 (오전) 9시 00분~(오후) 6시 00분 주소정근로시간 : 40시간 [급여조건] - 연봉...
http://kr.indeed.com/viewjob?jk=5d6fe86a441b59ba,Data Science Intern,Ace I&M Consulting 서울 중구,"월급 1,800,000원","projects on a time-series data. • Proficiency in SQL, Python, R (not required), MATLAB (not required), Java (not required..."
http://kr.indeed.com/viewjob?jk=57bb567ca6eeaca1,연구소 개발부문 연구원 직원 (회로설계/하드웨어설계/머신비전/이미지프로세...,모든 경기도 광명,"연봉 42,000,000원 - 46,000,000원","프로그래밍 가능자 우대S/W 설계 부문 : - OPEN CV, TENSORFLOW, YOLO, CUDA/ Python, C++, C WindowsGUL APL, MFC Lib 활용 가능자. 머신비전/ 영상처리 개발자* 전기..."
http://kr.indeed.com/viewjob?jk=c50980a13561ae0d,기술연구소 웹개발(JAVA/ASP/Python) 및 웹디자이너,엔잡얼라이언스 서울 금천구,"월급 2,000,000원","직무내용] Java 기반 웹개발, 모바일웹개발 및 유지보수 Python 및 AI 개발자, 딥러닝/머신러닝 활용, TensorFlow 활용웹디자인 웹퍼블리싱ASP, MS-SQL기반 웹프로그램 개발 [근무시간 및 형태] 주 5일..."
http://kr.indeed.com/viewjob?jk=aac8e9355cb855ac,[인재풀] 아티스트,Electronic Arts 서울,,Maya or 3D Max등의 아트웍 툴 사용 경험 Max script 또는 Mel Script의 사용 경험 C# 또는 Python 언어에 대한 이해 및 활용 능력 아트웍 관련 툴 제작 또는 플러그인 제작 경험
http://kr.indeed.com/viewjob?jk=fb7671cb525c01d4,2021년 5월 경력사원,세메스 천안 서북구,,"역량 (C++, Python, Vision Library 등) AI... 머신러닝, 데이터마이닝 기반 데이터 분석 시스템 개발 경력 Python, R, SAS 등 프로그래밍 경력 부품 표준화 Etch/물류..."
http://kr.indeed.com/viewjob?jk=c30199c246d18ea8,[정규직] 웹개발자 경력직,링크프라이스 서울 금천구,,"Crawling 개발 가능하신 분▶ Python 언어 사용 가능하신 분※개발환경 : Java, JSP, Spring, MyBatis, jQuery, DHTMLX, MSSQL, MariaDB, Python, C#.net 0 명..."
http://kr.indeed.com/viewjob?jk=979279a9428ebc27,Data Mining Specialist,Thermo Fisher Scientific 3.5 서울,,"Preferably understanding of analytics and business intelligence technologies... R, Python, Power BI or MS AI solutions"
http://kr.indeed.com/viewjob?jk=2b9e604e63e7e46d,[카카오커머스] 기술직군,카카오커머스 성남 분당구,,"우대사항 - 전자금융 감독규정, PCIDSS에 대한 실무 경험이나 이해도가 높으신 분 - JAVA, Python, shell script 등 개발 역량을 갖추신 분 - 웹/앱 취약점 진단 및 모의해킹 역량을 갖추신..."
http://kr.indeed.com/viewjob?jk=69f4620cb92eaa59,Intern - Research (Data Analysis),United Nations ESCAP 대전,,"analysis tools or programming languages (e.g. STATA, R, Python, etc... data visualization software (e.g. Tableau..."
http://kr.indeed.com/viewjob?jk=9acc17c535b42959,2021년 (신입) 전문연구요원 모집,NHN 4.4 성남 판교역,,"병역특례 전문연구요원 - Python/C++/Java/C# 개발 경험... 유연한 사고와 원활한 커뮤니케이션 능력 우대 - C/C++, Python 등 개발 숙련자 우대 공통지원자격(필수) - 해당 분야 석사 이상..."
http://kr.indeed.com/viewjob?jk=aa13332a8009c705,Application Engineer Korea,IMS Nanofabrication 경기도 화성,,"You are committing to support the team in challenging situations. Python, Office solutions and Linux experience is beneficial..."
http://kr.indeed.com/viewjob?jk=0f7993638aee82bd,Deep Learning Researcher (Intern),Qualcomm Korea YH 서울,,"Adversarial attacks, examples Minimum Qualifications • Python Programming • Deep learning with hands-on experience of deep..."
http://kr.indeed.com/viewjob?jk=d508fe23e877b560,[한양대 에리카]기업부설연구소 연구원(신입/경력/인턴),워너버스이노베이션 안산 상록구,,NET|인터넷·IT·통신·모바일·게임>응용프로그래머>C#|인터넷·IT·통신·모바일·게임>응용프로그래머> Python|인터넷·IT·통신·모바일·게임>응용프로그래머>인공지능(AI)|인터넷·IT·통신·모바일·게임>응용프로그래머...
http://kr.indeed.com/viewjob?jk=35ba221c73ad31a2,Data Engineer,Barbaricum 경기도 평택,,"data APIs, data modeling, and data warehousing solutions. R, Python, Ruby, C++, Perl, Java, SAS, SPSS, and Matlab. Strong..."
http://kr.indeed.com/viewjob?jk=abbb8df34c660e0a,"빅데이터, (AI)인공지능 외 신입/경력 인턴 (정규직전환)",스칼라웍스 서울 금천구,,인공지능)>인공지능(AI)|인터넷·IT·통신·모바일·게임>빅데이터·AI(인공지능)>데이터분석|인터넷·IT·통신·모바일·게임>빅데이터·AI(인공지능)> Python|인터넷·IT·통신·모바일·게임>빅데이터·AI(인공지능)>딥러닝
http://kr.indeed.com/viewjob?jk=dfb20fa220f3c478,"빅데이터, 인공지능(AI) 외 신입/경력 인턴",스칼라웍스 대한민국,,인공지능)>인공지능(AI)|인터넷·IT·통신·모바일·게임>빅데이터·AI(인공지능)>데이터분석|인터넷·IT·통신·모바일·게임>빅데이터·AI(인공지능)> Python|인터넷·IT·통신·모바일·게임>빅데이터·AI(인공지능)>딥러닝
http://kr.indeed.com/viewjob?jk=ac9068957c550cb3,데이터 전문가(모델러/분석가/엔지니어) 모집,카카오 4.0 성남 판교역,,대용량 데이터를 효율적으로 사용하기 위한 기반 데이터 가공 지원자격 데이터 사이언스를 위한 언어(R/ Python/Scala) 및 도구(scikit-learn/Spark MLlib/Tensorflow/Pytorch 등)를...
http://kr.indeed.com/viewjob?jk=f227e4e5212e6198,웹개발 및 서버개발자 신입/경력 정규직,큰사람커넥트 서울 구로구,,백엔드|인터넷·IT·통신·모바일·게임>웹프로그래머>프론트엔드|인터넷·IT·통신·모바일·게임>웹프로그래머> Python|인터넷·IT·통신·모바일·게임>빅데이터·AI(인공지능)>딥러닝|인터넷·IT·통신·모바일·게임>빅데이터·AI...
http://kr.indeed.com/viewjob?jk=e4e7e2e0d73f981f,Data Scientist,Barbaricum 경기도 평택,,"Tools, and Techniques Demonstrated proficiency with R or Python, and SQL to manipulate data and draw insights from large..."
http://kr.indeed.com/viewjob?jk=6fc2719750916dd3,Deep Learning Engineer,Intel 4.1 서울,,MxNet - Strong programming skills with C/C++ and Python - Experiences in programming and testing on Linux environment...
http://kr.indeed.com/viewjob?jk=8248de2f3c41ef06,Data Analyst,Barbaricum 경기도 평택,,"3 years of experience. Documented proficiency with R or Python, and SQL to manipulate data and draw insights from large..."
http://kr.indeed.com/viewjob?jk=0064deb5fa9cbce0,데이터 사이언티스트 모집,카카오 4.0 성남 판교역,,"양한 실험을 통해 알고리즘을 개선합니다. 지원자격 지원자격 하나 이상의 프로그래밍 언어에 익숙한 분( Python, Java, C/C++, Scala 등) 머신러닝/딥러닝 오픈소스를 이용하여 1년 이상 특정 서비스에 모델..."
http://kr.indeed.com/viewjob?jk=a64e1e21f61265ce,각 분야별 인재 Pool 등록,지투알 서울,,"자 - 데이터 분석 툴(Adobe Analytics 또는 Google Analytics) 유경험자 우대 - Python, R, SQL 역량 보유자 우대 - 데이터에 기반한 문제해결 능력 및 통계학적 지식 보유자 우대 - 담당..."
